pmid,title,journal,year,drug,disease
40910780,Left Atrial Appendage Occlusion Devices Focused on Complications of Therapy.,Cardiology in review,2025,Warfarin,Pulmonary Embolism
40910144,When viral myocarditis meets thrombosis tendency: deep analysis of a complex case report.,Frontiers in cardiovascular medicine,2025,Warfarin,Pulmonary Embolism
40855902,Management of Venous Thromboembolism After Hip and Knee Arthroplasty.,Journal of orthopaedics and sports medicine,2025,Warfarin,Pulmonary Embolism
40822463,Comparative clinical outcomes of acenocoumarol versus direct oral anticoagulants (DOACs) and warfarin in patients with atrial fibrillation: real-world-evidence (SIESTA-A study).,Frontiers in pharmacology,2025,Warfarin,Pulmonary Embolism
40821827,Impact of thromboplastin reagents on monitoring INR in a patient with triple-positive antiphospholipid syndrome: a case report.,Frontiers in immunology,2025,Warfarin,Pulmonary Embolism
40799748,Post-operative anticoagulation therapy after knee or hip replacement: The role of patients' preferences in selection of therapy.,Research square,2025,Warfarin,Pulmonary Embolism
40741114,ST Elevation in aVR: An Atypical Presentation of Pulmonary Embolism.,Clinical case reports,2025,Warfarin,Pulmonary Embolism
40735297,Effectiveness and safety of rivaroxaban vs warfarin in patients with pulmonary embolism and right ventricular dysfunction: a retrospective cohort study.,Research and practice in thrombosis and haemostasis,2025,Warfarin,Pulmonary Embolism
40718539,Silent misplacement: leadless pacemaker in the left ventricle discovered over a year later-How did it end up there? Could it explain the stroke?,Oxford medical case reports,2025,Warfarin,Pulmonary Embolism
40710796,Oral Anticoagulants in Chronic Thromboembolic Pulmonary Hypertension: Tradition or Innovation?,Journal of cardiovascular development and disease,2025,Warfarin,Pulmonary Embolism
40672974,Association of Pulmonary Septic Embolism and Pulmonary Arterial Thromboembolism in Lemierre Syndrome: A Case Report and Literature Review.,Respirology case reports,2025,Warfarin,Pulmonary Embolism
40606489,Evaluating the Effect of Concomitant Azoles on Anticoagulant Prescribing Practices in Transplant Patients: A National Survey of Clinicians.,The Journal of pharmacy technology : jPT : official publication of the Association of Pharmacy Technicians,2025,Warfarin,Pulmonary Embolism
40597582,Internal thoracic artery aneurysm coincidental with protein S deficiency: a case report.,International journal of emergency medicine,2025,Warfarin,Pulmonary Embolism
40565400,Anticoagulation in Patients with End-Stage Renal Disease: A Critical Review.,"Healthcare (Basel, Switzerland)",2025,Warfarin,Pulmonary Embolism
40544392,Potential association of TGFbeta1 plasma levels and fibrinolysis parameters with the risk of recurrence and vascular obstruction after a first unprovoked pulmonary embolism episode.,Journal of thrombosis and thrombolysis,2025,Warfarin,Pulmonary Embolism
40497467,Antiplatelet versus anticoagulation treatment for people with heart failure in sinus rhythm.,The Cochrane database of systematic reviews,2025,Warfarin,Pulmonary Embolism
40497246,Perioperative Anticoagulation in Hand Surgery: A Systematic Review.,JPRAS open,2025,Warfarin,Pulmonary Embolism
40485907,Direct Oral Anticoagulants Compared to Warfarin in Patients with Intermediate- to High-Risk Pulmonary Embolism: A Systematic Review and Meta-Analysis.,EJHaem,2025,Warfarin,Pulmonary Embolism
40483337,Literature-based case analysis of serious adverse drug events associated with edoxaban.,European journal of clinical pharmacology,2025,Warfarin,Pulmonary Embolism
40446982,Sticky Platelet Syndrome: An important consideration for otherwise unexplained thrombotic events in young stroke patients.,Journal of stroke and cerebrovascular diseases : the official journal of National Stroke Association,2025,Warfarin,Pulmonary Embolism
40409773,Unusual presentation of heparin-induced thrombocytopenia and thrombosis (HITT) with multiple organ involvement.,BMJ case reports,2025,Warfarin,Pulmonary Embolism
40405907,"Therapeutic Options for the Prevention of Thromboses in Cushing's Syndrome: A Propensity-Matched, Retrospective Cohort Analysis.",Cureus,2025,Warfarin,Pulmonary Embolism
40245061,Oral anticoagulant use among Medicare patients newly diagnosed with venous thromboembolism (VTE): Factors associated with treatment status.,PloS one,2025,Warfarin,Pulmonary Embolism
40177744,Outcomes Following Minimally Invasive Surgery for Intracerebral Hemorrhage in the AHA Get With The Guidelines-Stroke Registry.,Stroke,2025,Warfarin,Pulmonary Embolism
40132932,Fever and extensive venous and intracardiac thrombus in Behcet syndrome.,BMJ case reports,2025,Warfarin,Pulmonary Embolism
40113083,Milestones in therapeutic and antithrombotic strategies for chronic thromboembolic pulmonary hypertension.,Journal of cardiology,2025,Warfarin,Pulmonary Embolism
40095578,Anticoagulation Management: Current Landscape and Future Trends.,Journal of clinical medicine,2025,Warfarin,Pulmonary Embolism
40050974,The novel SERPINC1 missense mutation c.1148 T > A (p.L383H) causes hereditary antithrombin deficiency and thromboembolism in a Chinese family: a case report.,Journal of medical case reports,2025,Warfarin,Pulmonary Embolism
40017358,[Development and validation of a nomogram prediction model for in-hospital mortality risk in patients with sepsis complicated with acute pulmonary embolism].,Zhonghua wei zhong bing ji jiu yi xue,2025,Warfarin,Pulmonary Embolism
39962569,Comparing the post-operative complications following surgery for hip fracture of patients who were on warfarin versus patients who were on novel oral anticoagulants: a meta-analysis.,"Perioperative medicine (London, England)",2025,Warfarin,Pulmonary Embolism
39959230,The effect of rivaroxaban as an anticoagulant therapy for acute pulmonary embolism and the predictive role of vascular endothelial markers in assessing anticoagulant efficacy before treatment.,American journal of translational research,2025,Warfarin,Pulmonary Embolism
39955612,Right Bundle Branch Block on ECG as a Predictor of Sudden Cardiac Arrest Due to Pulmonary Embolism.,The American journal of case reports,2025,Warfarin,Pulmonary Embolism
39890080,Continuation of anticoagulation through ambulatory phlebectomy does not impact postoperative bleeding risk.,Journal of vascular surgery. Venous and lymphatic disorders,2025,Warfarin,Pulmonary Embolism
39873294,Interrupted versus uninterrupted anticoagulation for cardiac rhythm management device insertion.,The Cochrane database of systematic reviews,2025,Warfarin,Pulmonary Embolism
39794082,A 51-Year-Old Man With Dyspnea and a Pulmonary Nodule.,Chest,2025,Warfarin,Pulmonary Embolism
39729166,Comparative Safety and Efficacy of Non-vitamin K Antagonist Oral Anticoagulants (NOACs) Versus Warfarin in Deep Vein Thrombosis (DVT) Treatment: A Meta-analysis.,Cardiovascular drugs and therapy,2024,Warfarin,Pulmonary Embolism
39709948,Direct-Acting Oral Anticoagulant Dabigatran as a Bridging Therapy while Optimizing Warfarin Dosage for Cardioembolic Stroke.,Cerebrovascular diseases extra,2025,Warfarin,Pulmonary Embolism
39596945,Bleeding and Thrombotic Events in Hemodialysis Patients with Atrial Fibrillation on Anticoagulation and Antiplatelet Therapy: A 24-Month Cohort Study.,"Medicina (Kaunas, Lithuania)",2024,Warfarin,Pulmonary Embolism
39590196,Pregnant Woman in Outcomes with Prosthetic Heart Valves.,Journal of cardiovascular development and disease,2024,Warfarin,Pulmonary Embolism
39575034,Management of Saddle Pulmonary Embolism in the Context of Heparin-Induced Thrombocytopenia and Granulomatosis With Polyangiitis.,Cureus,2024,Warfarin,Pulmonary Embolism
39571225,Direct oral anticoagulant prescribing trends for venous thromboembolism among adult patients with obesity at University of Utah Health.,Thrombosis research,2025,Warfarin,Pulmonary Embolism
39563127,Management of Acute Pulmonary Embolism: A Review.,The Journal of the Association of Physicians of India,2024,Warfarin,Pulmonary Embolism
39525737,Breaking boundaries: exploring recent advances in anticoagulation and thrombosis management: a comprehensive review.,Annals of medicine and surgery (2012),2024,Warfarin,Pulmonary Embolism
39467286,Ten-Year Trends in Venous Thromboembolism Prophylaxis at a High-Volume Arthroplasty Center.,The Journal of the American Academy of Orthopaedic Surgeons,2024,Warfarin,Pulmonary Embolism
39421228,Unmasking the Rarity: A Case Report on Platypnea-Orthodeoxia Syndrome With Successful Resolution Through Patent Foramen Ovale Closure.,Journal of medical cases,2024,Warfarin,Pulmonary Embolism
39391223,The disease progression of end-stage atrial cardiomyopathy over three decades: a case report.,European heart journal. Case reports,2024,Warfarin,Pulmonary Embolism
39372133,Management and Outcomes of Pulmonary Embolism in the Oldest-Old.,International journal of general medicine,2024,Warfarin,Pulmonary Embolism
39357687,Chronic Anticoagulation in Patients Who Have Atrial Fibrillation Undergoing Outpatient Total Knee Arthroplasty: A Retrospective Matched Cohort Study.,The Journal of arthroplasty,2025,Warfarin,Pulmonary Embolism
39355923,Effects of Catheter-Based Renal Denervation in Hypertension: A Systematic Review and Meta-Analysis.,Circulation,2024,Warfarin,Pulmonary Embolism
39319460,Prediction of Severe Baseline Asymptomatic Carotid Stenosis and Subsequent Risk of Stroke and Cardiovascular Disease.,Stroke,2024,Warfarin,Pulmonary Embolism
