pmid,title,journal,year,drug,disease
40504081,Changes in Gait Speed Vary Widely after the Use of Antiparkinson Medication in Persons with Parkinson's Disease.,Movement disorders clinical practice,2025,Levodopa,Multiple Sclerosis
40200913,Anosmia and Upper Limb Rigidity-A Potential Phenotype of Idiopathic Normal Pressure Hydrocephalus with Cerebrospinal Fluid alpha-Synuclein Seeds.,Movement disorders : official journal of the Movement Disorder Society,2025,Levodopa,Multiple Sclerosis
38858084,Historical Perspectives of Parkinson's Disease: Early Clinical Descriptions and Neurological Therapies.,Cold Spring Harbor perspectives in medicine,2025,Levodopa,Multiple Sclerosis
38049430,A meta-analysis identifies factors predicting the future development of freezing of gait in Parkinson's disease.,NPJ Parkinson's disease,2023,Levodopa,Multiple Sclerosis
37741692,A(2A)R antagonist treatment for multiple sclerosis: Current progress and future prospects.,International review of neurobiology,2023,Levodopa,Multiple Sclerosis
37419676,Amantadine toxicity causing visual hallucinations.,Practical neurology,2023,Levodopa,Multiple Sclerosis
36660836,[Neurology: what's new in 2022].,Revue medicale suisse,2023,Levodopa,Multiple Sclerosis
35822248,A case of Lewy body disease and anaplastic astrocytoma presenting with atypical parkinsonism.,Neuropathology : official journal of the Japanese Society of Neuropathology,2022,Levodopa,Multiple Sclerosis
35713861,A Simple Computational Approach to Identify Potential Drugs for Multiple Sclerosis and Cognitive Disorders from Expert Curated Resources.,"Methods in molecular biology (Clifton, N.J.)",2022,Levodopa,Multiple Sclerosis
35094172,Mortality of Parkinson's disease in Italy from 1980 to 2015.,Neurological sciences : official journal of the Italian Neurological Society and of the Italian Society of Clinical Neurophysiology,2022,Levodopa,Multiple Sclerosis
34830352,Digging Deeper: Advancements in Visualization of Inhibitory Synapses in Neurodegenerative Disorders.,International journal of molecular sciences,2021,Levodopa,Multiple Sclerosis
33904433,Chronic Neurological Disorders: Genetic and Epigenetic Markers for Monitoring of Pharmacotherapy.,Neurology India,2021,Levodopa,Multiple Sclerosis
32278516,A review of possible therapies for Parkinson's disease.,Journal of clinical neuroscience : official journal of the Neurosurgical Society of Australasia,2020,Levodopa,Multiple Sclerosis
32247740,Possible therapies of Parkinson's disease: A review.,Journal of clinical neuroscience : official journal of the Neurosurgical Society of Australasia,2020,Levodopa,Multiple Sclerosis
31961088,[Neurology 2019].,Revue medicale suisse,2020,Levodopa,Multiple Sclerosis
31855690,"Obstructive sleep apnea, CPAP therapy and Parkinson's disease motor function: A longitudinal study.",Parkinsonism & related disorders,2020,Levodopa,Multiple Sclerosis
31603904,Characterization of Parkinson's disease using blood-based biomarkers: A multicohort proteomic analysis.,PLoS medicine,2019,Levodopa,Multiple Sclerosis
31219471,Aplicaciones terapeuticas por accion de los cannabinoides.,Gaceta medica de Mexico,2019,Levodopa,Multiple Sclerosis
31186958,"Clinical Features and Treatment in the Spectrum of Paroxysmal Dyskinesias: An Observational Study in South-West Castilla y Leon, Spain.",Neurology research international,2019,Levodopa,Multiple Sclerosis
30185686,Poststroke emotionalism with dacrystic (Crying) episodes - making a case for risperidone.,Annals of African medicine,2018,Levodopa,Multiple Sclerosis
28847275,Pharmacologic Considerations during the Preoperative Evaluation of Neurologic Patients.,Current clinical pharmacology,2017,Levodopa,Multiple Sclerosis
28655059,Association of Autonomic Dysfunction With Disease Progression and Survival in Parkinson Disease.,JAMA neurology,2017,Levodopa,Multiple Sclerosis
28480854,UNUSUAL MANIFESTATION OF NEUROBORELIOSIS (CASE REPORT).,Georgian medical news,2017,Levodopa,Multiple Sclerosis
28244186,Cerebrospinal fluid levels of catecholamines and its metabolites in Parkinson's disease: effect of l-DOPA treatment and changes in levodopa-induced dyskinesia.,Journal of neurochemistry,2017,Levodopa,Multiple Sclerosis
27833521,Treatment responsive Holmes tremor: case report and literature review.,International journal of health sciences,2016,Levodopa,Multiple Sclerosis
26579223,Transcranial magnetic stimulation to understand pathophysiology and as potential treatment for neurodegenerative diseases.,Translational neurodegeneration,2015,Levodopa,Multiple Sclerosis
26365142,GABAergic Pharmacotherapy in the Treatment of Motor Disorders of the Central Nervous System.,Current pharmaceutical design,2015,Levodopa,Multiple Sclerosis
26275564,C9ORF72 intermediate repeat expansion in patients affected by atypical parkinsonian syndromes or Parkinson's disease complicated by psychosis or dementia in a Sardinian population.,Journal of neurology,2015,Levodopa,Multiple Sclerosis
24778283,Systematic review: efficacy and safety of medical marijuana in selected neurologic disorders [RETIRED]: report of the Guideline Development Subcommittee of the American Academy of Neurology.,Neurology,2014,Levodopa,Multiple Sclerosis
24112895,"Deep brain stimulation for other tremors, myoclonus, and chorea.",Handbook of clinical neurology,2013,Levodopa,Multiple Sclerosis
23413259,C9orf72 repeat expansions are a rare genetic cause of parkinsonism.,Brain : a journal of neurology,2013,Levodopa,Multiple Sclerosis
22229124,The history of Parkinson's disease: early clinical descriptions and neurological therapies.,Cold Spring Harbor perspectives in medicine,2011,Levodopa,Multiple Sclerosis
21948012,[Neurology of laughter and humour: pathological laughing and crying].,Revista de neurologia,2011,Levodopa,Multiple Sclerosis
21881474,A coincidental case of young-onset Parkinson disease and multiple sclerosis.,The neurologist,2011,Levodopa,Multiple Sclerosis
21540059,Significant effects of 4-aminopyridine and tetraethylammonium in the treatment of 6-hydroxydopamine-induced Parkinson's disease.,Behavioural brain research,2011,Levodopa,Multiple Sclerosis
20884645,Fatigue in Parkinson's disease is linked to striatal and limbic serotonergic dysfunction.,Brain : a journal of neurology,2010,Levodopa,Multiple Sclerosis
19957206,Increasing CNS noradrenaline reduces EAE severity.,Journal of neuroimmune pharmacology : the official journal of the Society on NeuroImmune Pharmacology,2010,Levodopa,Multiple Sclerosis
21686707,Dramatic response to levetiracetam in post-ischaemic Holmes' tremor.,BMJ case reports,2009,Levodopa,Multiple Sclerosis
17914725,A unique case of coincidence of early onset Parkinson's disease and multiple sclerosis.,Movement disorders : official journal of the Movement Disorder Society,2007,Levodopa,Multiple Sclerosis
17707550,"2,3-benzodiazepine-type AMPA receptor antagonists and their neuroprotective effects.",Neurochemistry international,2008,Levodopa,Multiple Sclerosis
17702034,Primary lateral sclerosis mimicking atypical parkinsonism.,Movement disorders : official journal of the Movement Disorder Society,2007,Levodopa,Multiple Sclerosis
17230484,Dopamine agonist-induced pathological gambling in restless legs syndrome due to multiple sclerosis.,Movement disorders : official journal of the Movement Disorder Society,2007,Levodopa,Multiple Sclerosis
17131224,Dropped head in Parkinson's disease.,Journal of neurology,2006,Levodopa,Multiple Sclerosis
15895873,Recent developments in the therapeutic potential of cannabinoids.,Puerto Rico health sciences journal,2005,Levodopa,Multiple Sclerosis
15654043,Multiple pathologies in a patient with a progressive neurodegenerative syndrome.,"Journal of neurology, neurosurgery, and psychiatry",2005,Levodopa,Multiple Sclerosis
14962622,"The two faces of L-DOPA: benefits and adverse side effects in the treatment of Encephalitis lethargica, Parkinson's disease, multiple sclerosis and amyotrophic lateral sclerosis.",Medical hypotheses,2004,Levodopa,Multiple Sclerosis
11924029,[Respiratory disorders during sleep in degenerative diseases of the brain stem].,Revue neurologique,2001,Levodopa,Multiple Sclerosis
10193597,Classification of tremor and update on treatment.,American family physician,1999,Levodopa,Multiple Sclerosis
1906932,Hyperprolactinemia in multiple sclerosis.,Journal of the neurological sciences,1991,Levodopa,Multiple Sclerosis
2191085,Stereotaxic thalamotomy--experiences from the levodopa era.,"Journal of neurology, neurosurgery, and psychiatry",1990,Levodopa,Multiple Sclerosis
