PMID,Title,Journal,Year
40235103,Clinical Characteristics and Visual Outcomes of Cat Scratch Disease.,Korean journal of ophthalmology : KJO,2025
29367931,Oral Doxycycline Reduces the Total Number of Intraocular Bevacizumab Injections Needed to Control Neovascular Age-related Macular Degeneration.,"Medical hypothesis, discovery & innovation ophthalmology journal",2017
26427481,"Cre Recombinase: You Can't Live with It, and You Can't Live Without It.",Advances in experimental medicine and biology,2016
24969516,Effect of doxycycline vs placebo on retinal function and diabetic retinopathy progression in mild to moderate nonproliferative diabetic retinopathy: a randomized proof-of-concept clinical trial.,JAMA ophthalmology,2014
24604308,Effect of doxycycline vs placebo on retinal function and diabetic retinopathy progression in patients with severe nonproliferative or non-high-risk proliferative diabetic retinopathy: a randomized clinical trial.,JAMA ophthalmology,2014
17914405,Oral administration of doxycycline allows tight control of transgene expression: a key step towards gene therapy of retinal diseases.,Gene therapy,2007
17685494,"Helper-dependent adenovirus for the gene therapy of proliferative retinopathies: stable gene transfer, regulated gene expression and therapeutic efficacy.",The journal of gene medicine,2007
12670875,"Intraocular expression of endostatin reduces VEGF-induced retinal vascular permeability, neovascularization, and retinal detachment.",FASEB journal : official publication of the Federation of American Societies for Experimental Biology,2003
10415738,MMP-mediated events in diabetes.,Annals of the New York Academy of Sciences,1999
