PMID,Title,Journal,Year
34995795,Esomeprazole alleviates fibrosis in systemic sclerosis by modulating AhR/Smad2/3 signaling.,Pharmacological research,2022
34413685,Multiple Sclerosis Presenting with Sixth Nerve Palsy in a Child.,International medical case reports journal,2021
30590025,Repurposing of omeprazole for oligodendrocyte differentiation and remyelination.,Brain research,2019
30023055,Sudden sensorineural hearing loss in atypical Cogan's syndrome: A case report.,Annals of medicine and surgery (2012),2018
26991517,Therapeutic protein-drug interaction assessment for daclizumab high-yield process in patients with multiple sclerosis using a cocktail approach.,British journal of clinical pharmacology,2016
25190469,The effect of omeprazole on the development of experimental autoimmune encephalomyelitis in C57BL/6J and SJL/J mice.,BMC research notes,2014
