pmid,title,journal,year,drug,disease
28975092,Self-limited membranous nephropathy after intravitreal bevacizumab therapy for age-related macular degeneration.,Journal of nephropathology,2017,Lisinopril,Age-related Macular Degeneration
18491126,Central retinal vein occlusion with non-arteritic ischemic optic neuropathy and cystoid macular edema.,Graefe's archive for clinical and experimental ophthalmology = Albrecht von Graefes Archiv fur klinische und experimentelle Ophthalmologie,2008,Lisinopril,Age-related Macular Degeneration
17876597,Role of retinal hypoxia in diabetic macular edema: a new concept.,Graefe's archive for clinical and experimental ophthalmology = Albrecht von Graefes Archiv fur klinische und experimentelle Ophthalmologie,2008,Lisinopril,Age-related Macular Degeneration
16564798,"A randomized, masked, cross-over trial of lisinopril for inflammatory macular edema.",American journal of ophthalmology,2006,Lisinopril,Age-related Macular Degeneration
15536018,Quantitative measurement of retinal thickness in patients with diabetic macular edema is useful for evaluation of therapeutic agents.,Diabetes research and clinical practice,2004,Lisinopril,Age-related Macular Degeneration
