pmid,title,journal,year,drug,disease
40876504,Metformin treatment protects mice from glucose-promoted psoriasiform dermatitis through enrichment of Akkermansia muciniphila with modulation of bacterial tryptophan metabolites.,The Journal of investigative dermatology,2025,Metformin,Psoriasis
40465202,"Metformin: Old Drug, New Therapeutic Potential in the Skin? A Brief Narrative Review.",Advances in therapy,2025,Metformin,Psoriasis
40289669,Nail Involvement Among Psoriasis Patients: A Comparative Retrospective Cohort Analysis of 2888 Egyptian Patients.,Experimental dermatology,2025,Metformin,Psoriasis
40075548,Psoriasis Risk Is Lower in Type 2 Diabetes Patients Using Dipeptidyl Peptidase-4 Inhibitors or Thiazolidinediones Compared to Sulfonylureas.,Clinical and translational science,2025,Metformin,Psoriasis
39946251,Dermatologic Implications of Glycemic Control Medications for Patients with Type 2 Diabetes Mellitus.,Cutis,2025,Metformin,Psoriasis
39858442,"Effects of Semaglutide Treatment on Psoriatic Lesions in Obese Patients with Type 2 Diabetes Mellitus: An Open-Label, Randomized Clinical Trial.",Biomolecules,2025,Metformin,Psoriasis
39703496,A Systematic Review on Clinical Evidence for Topical Metformin: Old Medication With New Application.,Health science reports,2024,Metformin,Psoriasis
39446079,Combination therapy of systemic and local metformin improves imiquimod-induced psoriasis-like lesions with type 2 diabetes: the role of AMPK/KGF/STAT3 axis.,Archives of physiology and biochemistry,2025,Metformin,Psoriasis
39121669,Topical application of phenformin ameliorates the psoriasis-like inflammatory response via the inhibition of c-Myc expression in keratinocytes.,Biochemical and biophysical research communications,2024,Metformin,Psoriasis
39013549,Molecular mechanisms and drug therapy of metabolism disorders in psoriasis.,The Journal of dermatological treatment,2024,Metformin,Psoriasis
38745849,Cardiovascular Considerations and Implications for Treatment in Psoriasis: An Updated Review.,Vascular health and risk management,2024,Metformin,Psoriasis
38028405,The efficacy of metformin for the treatment of psoriasis: a meta-analysis study.,Postepy dermatologii i alergologii,2023,Metformin,Psoriasis
37820943,"Design, synthesis and characterization of a novel multicomponent salt of bexarotene with metformin and application in ameliorating psoriasis with T2DM.",International journal of pharmaceutics,2023,Metformin,Psoriasis
37782836,Site-Specifically Launched Microneedles for the Combined Treatment of Psoriasis-Diabetic Comorbidity.,ACS applied materials & interfaces,2023,Metformin,Psoriasis
37672020,Adenosine 5'monophosphate-activated protein kinase activation reduces the risks of psoriasis and its comorbidities: a Mendelian randomization study in the UK Biobank.,"Rheumatology (Oxford, England)",2024,Metformin,Psoriasis
37242462,Rosiglitazone Does Not Affect the Risk of Inflammatory Bowel Disease: A Retrospective Cohort Study in Taiwanese Type 2 Diabetes Patients.,"Pharmaceuticals (Basel, Switzerland)",2023,Metformin,Psoriasis
36961533,Overexpression of hypoxia-inducible factor-1alpha in hidradenitis suppurativa: the link between deviated immunity and metabolism.,Archives of dermatological research,2023,Metformin,Psoriasis
36921584,Differential Effects of Metformin on Immune-Mediated and Androgen-Mediated Non-Cancer Skin Diseases in Diabetes Patients: A Retrospective Cohort Study.,"Dermatology (Basel, Switzerland)",2023,Metformin,Psoriasis
36558989,Pioglitazone Has a Null Association with Inflammatory Bowel Disease in Patients with Type 2 Diabetes Mellitus.,"Pharmaceuticals (Basel, Switzerland)",2022,Metformin,Psoriasis
36214696,"Phytochemical investigation, structural elucidation, in silico study and anti-psoriatic activity of potent bioactive from Betula utilis.",Journal of biomolecular structure & dynamics,2023,Metformin,Psoriasis
35954273,Phenformin Down-Regulates c-Myc Expression to Suppress the Expression of Pro-Inflammatory Cytokines in Keratinocytes.,Cells,2022,Metformin,Psoriasis
35910506,Metformin Inhibits HaCaT Cell Proliferation Under Hyperlipidemia Through Reducing Reactive Oxygen Species via FOXO3 Activation.,"Clinical, cosmetic and investigational dermatology",2022,Metformin,Psoriasis
35569426,[The role of metformin in the treatment of dermatological diseases: A narrative review].,Atencion primaria,2022,Metformin,Psoriasis
35492738,The Combined Use of Metformin and Methotrexate in Psoriasis Patients with Metabolic Syndrome.,Dermatology research and practice,2022,Metformin,Psoriasis
35266419,Co-encapsulation of metformin and ginger into the liposomes: in vitro characterization and in vivo anti-psoriasis evaluation.,Drug development and industrial pharmacy,2021,Metformin,Psoriasis
34884312,The Antidiabetic Agent Metformin Inhibits IL-23 Production in Murine Bone-Marrow-Derived Dendritic Cells.,Journal of clinical medicine,2021,Metformin,Psoriasis
34512883,Clinical effects of antidiabetic drugs on psoriasis: The perspective of evidence-based medicine.,World journal of diabetes,2021,Metformin,Psoriasis
34490702,Association between alpha-glucosidase inhibitor use and psoriatic disease risk in patients with type 2 diabetes mellitus: A population-based cohort study.,International journal of clinical practice,2021,Metformin,Psoriasis
34463640,Two birds one stone: semaglutide is highly effective against severe psoriasis in a type 2 diabetic patient.,"Endocrinology, diabetes & metabolism case reports",2021,Metformin,Psoriasis
33808460,Is Metformin a Possible Beneficial Treatment for Psoriasis? A Scoping Review.,Journal of personalized medicine,2021,Metformin,Psoriasis
33255783,A Molecular Perspective on the Potential Benefits of Metformin for the Treatment of Inflammatory Skin Disorders.,International journal of molecular sciences,2020,Metformin,Psoriasis
32914429,Effects of antidiabetic drugs on psoriasis: A meta-analysis.,European journal of clinical investigation,2021,Metformin,Psoriasis
32845585,Oral Metformin for Treating Dermatological Diseases: A Systematic Review.,Journal of drugs in dermatology : JDD,2020,Metformin,Psoriasis
32755965,Type B insulin resistance syndrome associated with connective tissue disease and psoriasis.,"Endocrinology, diabetes & metabolism case reports",2020,Metformin,Psoriasis
32194991,Metformin inhibits IL-1beta secretion via impairment of NLRP3 inflammasome in keratinocytes: implications for preventing the development of psoriasis.,Cell death discovery,2020,Metformin,Psoriasis
30779846,Safety of Metformin in Psoriasis Patients With Diabetes Mellitus: A 17-Year Population-Based Real-World Cohort Study.,The Journal of clinical endocrinology and metabolism,2019,Metformin,Psoriasis
30745987,Quality of Life in Psoriasis Vietnamese Patients Treated with Metformin in Combination with Methotrexate.,Open access Macedonian journal of medical sciences,2019,Metformin,Psoriasis
30520054,Metformin inhibits pro-inflammatory responses via targeting nuclear factor-kappaB in HaCaT cells.,Cell biochemistry and function,2019,Metformin,Psoriasis
30206977,A unified mitochondria mechanistic target of rapamycin acyl-coenzyme A dehydrogenase 10 signal relay modulation for metformin growth inhibition in human immortalized keratinocytes cells.,Journal of cellular biochemistry,2019,Metformin,Psoriasis
29549478,Metformin Promotes HaCaT Cell Apoptosis through Generation of Reactive Oxygen Species via Raf-1-ERK1/2-Nrf2 Inactivation.,Inflammation,2018,Metformin,Psoriasis
28893023,Itolizumab in the Management of Psoriasis with Metabolic Syndrome.,Journal of clinical and diagnostic research : JCDR,2017,Metformin,Psoriasis
28670544,Randomized Placebo Control Study of Metformin in Psoriasis Patients with Metabolic Syndrome (Systemic Treatment Cohort).,Indian journal of endocrinology and metabolism,2017,Metformin,Psoriasis
28538228,Glycemic Control in the Treatment of Psoriasis.,"Dermatology (Basel, Switzerland)",2017,Metformin,Psoriasis
27930978,Mechanism of action and effect of immune-modulating agents in the treatment of psoriasis.,Biomedicine & pharmacotherapy = Biomedecine & pharmacotherapie,2017,Metformin,Psoriasis
27574928,DRESS Syndrome Following Metformin Administration: A Case Report and Review of the Literature.,American journal of therapeutics,2016,Metformin,Psoriasis
27531132,Randomized placebo control study of insulin sensitizers (Metformin and Pioglitazone) in psoriasis patients with metabolic syndrome (Topical Treatment Cohort).,BMC dermatology,2016,Metformin,Psoriasis
26997714,Metformin - For the dermatologist.,Indian journal of pharmacology,2016,Metformin,Psoriasis
26305116,Metformin inhibits proliferation and proinflammatory cytokines of human keratinocytes in vitro via mTOR-signaling pathway.,Pharmaceutical biology,2016,Metformin,Psoriasis
25443628,Association between antidiabetic drugs and psoriasis risk in diabetic patients: results from a nationwide nested case-control study in Taiwan.,Journal of the American Academy of Dermatology,2015,Metformin,Psoriasis
24919467,Dipeptidyl peptidase-4 inhibitors in type 2 diabetes may reduce the risk of autoimmune diseases: a population-based cohort study.,Annals of the rheumatic diseases,2015,Metformin,Psoriasis
