PMID,Title,Journal,Year
40529844,Improving High-Risk Osteoporosis Medication Adherence and Safety With an Automated Dashboard.,"Federal practitioner : for the health care professionals of the VA, DoD, and PHS",2025
39799876,In silico evaluation of bisphosphonates identifies leading candidates for SARS-CoV-2 RdRp inhibition.,Journal of molecular graphics & modelling,2025
38795142,Evaluating the impact of COVID-19 on DXA waiting lists and osteoporosis prescription trends in England 2019-2023.,Osteoporosis international : a journal established as result of cooperation between the European Foundation for Osteoporosis and the National Osteoporosis Foundation of the USA,2024
38614429,Synergistic effect of Toll-like receptor 2 ligands and alendronate on proinflammatory cytokine production in mouse macrophage-like RAW-ASC cells is accompanied by upregulation of MyD88 expression.,Journal of oral biosciences,2024
36420354,Bisphosphonates for Post-COVID Osteonecrosis of the Femoral Head: Medical Management of a Surgical Condition.,JB & JS open access,2022
36125097,Anti-osteoporosis medication dispensing by clinical commissioning groups in England - an ecological study of variability in practice and of the effect of the Covid-19 pandemic.,Pharmacoepidemiology and drug safety,2023
35779846,Dispensing anti-osteoporotic drugs changed during the COVID-19 pandemic.,Bone,2022
34405441,The Use of Oral Amino-Bisphosphonates and Coronavirus Disease 2019 (COVID-19) Outcomes.,Journal of bone and mineral research : the official journal of the American Society for Bone and Mineral Research,2021
