PMID,Title,Journal,Year
39887461,Mesenchymal Stem Cells With Polydopamine-Coated NaGdF(4) Nanoparticles with Ca(2+) Chelation Ability for Ischemic Stroke Therapy.,"Advanced materials (Deerfield Beach, Fla.)",2025
37399106,A Comparative Study of Ultrasmall Calcium Carbonate Nanoparticles for Targeting and Imaging Atherosclerotic Plaque.,ACS nano,2023
26346502,"The impact of preadmission oral bisphosphonate use on 30-day mortality following stroke: a population-based cohort study of 100,043 patients.",Clinical epidemiology,2015
25435924,New strategies for osteoporosis patients previously managed with strontium ranelate.,Therapeutic advances in musculoskeletal disease,2014
20945149,Oral bisphosphonates and risk of ischemic stroke: a case-control study.,Osteoporosis international : a journal established as result of cooperation between the European Foundation for Osteoporosis and the National Osteoporosis Foundation of the USA,2011
