pmid,title,journal,year,drug,disease
39024368,"In-silico discovery of common molecular signatures for which SARS-CoV-2 infections and lung diseases stimulate each other, and drug repurposing.",PloS one,2024,Nilotinib,Asthma
38640424,Discovery of common molecular signatures and drug repurposing for COVID-19/Asthma comorbidity: ACE2 and multi-partite networks.,"Cell cycle (Georgetown, Tex.)",2024,Nilotinib,Asthma
32116722,Role of Platelet-Derived Growth Factor (PDGF) in Asthma as an Immunoregulatory Factor Mediating Airway Remodeling and Possible Pharmacological Target.,Frontiers in pharmacology,2020,Nilotinib,Asthma
27764539,Different anti-remodeling effect of nilotinib and fluticasone in a chronic asthma model.,The Korean journal of internal medicine,2016,Nilotinib,Asthma
24784417,Effect of nilotinib on airway remodeling in a murine model of chronic asthma.,Experimental lung research,2014,Nilotinib,Asthma
23441583,Twenty-first century mast cell stabilizers.,British journal of pharmacology,2013,Nilotinib,Asthma
22612424,Tyrosine kinase inhibitors as potential drugs for B-cell lymphoid malignancies and autoimmune disorders.,Expert opinion on investigational drugs,2012,Nilotinib,Asthma
