pmid,title,journal,year,drug,disease
40922849,Postoperative Stroke Through a Patent Foramen Ovale in a Patient With Lung Cancer: A Case Report.,Cureus,2025,Aspirin,Atrial Fibrillation
40891618,The Association between Coagulation Indices and Mortality in Critically Ill Patients with Atrial Fibrillation: A Retrospective Study.,Clinical and applied thrombosis/hemostasis : official journal of the International Academy of Clinical and Applied Thrombosis/Hemostasis,2025,Aspirin,Atrial Fibrillation
40886070,Cost-effectiveness of Apixaban vs Aspirin for the Reduction of Thrombo-Embolism in High-Risk Patients with Device-Detected Atrial Fibrillation: Insights from the ARTESiA trial.,"Europace : European pacing, arrhythmias, and cardiac electrophysiology : journal of the working groups on cardiac pacing, arrhythmias, and cardiac cellular electrophysiology of the European Society of Cardiology",2025,Aspirin,Atrial Fibrillation
40884758,Outcomes of cardiovascular screening in men aged 60-64 years: the DANCAVAS II trial.,European heart journal,2025,Aspirin,Atrial Fibrillation
40778853,A case of infective endocarditis with the manifestation of multi-organ embolisms: a case report.,Cardiovascular journal of Africa,2025,Aspirin,Atrial Fibrillation
40769726,MRI findings intracranial hemorrhages in ARCADIA-MRI: an ancillary study to the ARCADIA trial.,AJNR. American journal of neuroradiology,2025,Aspirin,Atrial Fibrillation
40766137,Cognitive trajectories and incident atrial fibrillation in the ASPREE cohort.,medRxiv : the preprint server for health sciences,2025,Aspirin,Atrial Fibrillation
40752875,Apixaban for stroke prevention in subclinical atrial fibrillation detected by an implantable cardiac monitor: A subgroup analysis of ARTESiA.,Heart rhythm,2025,Aspirin,Atrial Fibrillation
40731881,Embolic Stroke of Undetermined Source (ESUS): Exploring the Neurocardiological Axis and Its Clinical Implications.,"Medicina (Kaunas, Lithuania)",2025,Aspirin,Atrial Fibrillation
40674150,Prevention of unfavorable fibrin clots and thrombo-embolic manifestations in patients with cardiovascular disease.,Expert review of cardiovascular therapy,2025,Aspirin,Atrial Fibrillation
40646333,Transforming Culture: Postoperative Venous Thromboembolism Prophylaxis in a Transgender Patient on Estrogen.,Journal of general internal medicine,2025,Aspirin,Atrial Fibrillation
40645433,Atrial fibrillation progression in patients with device-detected subclinical atrial fibrillation: Insights from the ARTESiA trial.,Heart rhythm,2025,Aspirin,Atrial Fibrillation
40630456,Anticoagulation for Stroke Prevention in Patients with Atrial Fibrillation: A Review of the Literature and Current Guidelines.,Reviews in cardiovascular medicine,2025,Aspirin,Atrial Fibrillation
40615187,LAA Thrombus and Stroke From Surgical LAA Closure Failure From Suture Insufficiency Treated With LAAO.,JACC. Case reports,2025,Aspirin,Atrial Fibrillation
40611491,Long-Term Incidence of Dementia Following Transient Ischemic Attack: A Longitudinal Cohort Study.,Journal of the American Heart Association,2025,Aspirin,Atrial Fibrillation
40596340,Evaluation of gaps in direct oral anticoagulants (DOACs) management in an outpatient underserved clinic: a cross-sectional study.,Scientific reports,2025,Aspirin,Atrial Fibrillation
40550079,Left atrial appendage occlusion procedure and antithrombotics: less may be enough for lower risk patients: A single-center observational study.,Medicine,2025,Aspirin,Atrial Fibrillation
40546068,Abelacimab Versus Rivaroxaban in Patients With Atrial Fibrillation on Antiplatelet Therapy: A Prespecified Analysis of the AZALEA-TIMI 71 Trial.,Circulation,2025,Aspirin,Atrial Fibrillation
40512045,Subclinical atrial fibrillation: Who benefits from oral anticoagulation?,Kardiologia polska,2025,Aspirin,Atrial Fibrillation
40497467,Antiplatelet versus anticoagulation treatment for people with heart failure in sinus rhythm.,The Cochrane database of systematic reviews,2025,Aspirin,Atrial Fibrillation
40486457,Exploring Public Interest in Atrial Fibrillation and Its Treatment Measures: A Google Trends Analysis.,Cureus,2025,Aspirin,Atrial Fibrillation
40463807,Association of albuminuria with incident atrial fibrillation in healthy older adults.,Clinical kidney journal,2025,Aspirin,Atrial Fibrillation
40439132,Clinical outcomes with the use of aspirin versus clopidogrel as a combination therapy with direct oral anticoagulant after coronary stent implantation in patients with atrial fibrillation.,European heart journal. Cardiovascular pharmacotherapy,2025,Aspirin,Atrial Fibrillation
40413431,Direct oral anticoagulant and antiplatelet therapy for extracranial neurovascular stenting in patients with atrial fibrillation.,BMC neurology,2025,Aspirin,Atrial Fibrillation
40405701,Pharmacodynamic effects of early aspirin withdrawal after percutaneous coronary intervention in patients with atrial fibrillation treated with ticagrelor or prasugrel.,Platelets,2025,Aspirin,Atrial Fibrillation
40401627,Development and Validation of Models to Estimate the Incident Risk of Cognitive Impairment and Atherosclerotic Cardiovascular Disease in Older Adults.,Journal of the American Heart Association,2025,Aspirin,Atrial Fibrillation
40401606,Contemporary Use and Clinical Significance of Initial Triple Versus Double Therapy After Percutaneous Coronary Intervention for Myocardial Infarction in Patients With Atrial Fibrillation.,Journal of the American Heart Association,2025,Aspirin,Atrial Fibrillation
40348411,"Incidence, predictors and clinical impact of upper gastrointestinal bleeding after transcatheter aortic valve replacement.",Heart (British Cardiac Society),2025,Aspirin,Atrial Fibrillation
40341146,ASPirin for Acute Pneumonia in the elderlY (ASPAPY): protocol of a multicentre randomised double-blind placebo-controlled trial.,BMJ open,2025,Aspirin,Atrial Fibrillation
40296242,Secondary Stroke Prevention Trends in Low-Income Community-Dwelling Older Individuals.,The Senior care pharmacist,2025,Aspirin,Atrial Fibrillation
40294164,Premature Atrial Contractions as a Marker of Atrial Cardiopathy: A Revised Analysis of the ARCADIA Randomized Trial.,Journal of cardiovascular electrophysiology,2025,Aspirin,Atrial Fibrillation
40278201,Procedural and Antithrombotic Therapy Optimization in Patients with Atrial Fibrillation Undergoing Percutaneous Coronary Intervention: A Narrative Review.,Journal of cardiovascular development and disease,2025,Aspirin,Atrial Fibrillation
40260419,Scores to predict steatotic liver disease - correlates and outcomes in older adults.,Npj gut and liver,2025,Aspirin,Atrial Fibrillation
40190261,Does the Burden of CSVD Modify the Efficacy of Dual Antiplatelet Therapy?: A Post Hoc Analysis of the INSPIRES Trial.,Stroke,2025,Aspirin,Atrial Fibrillation
40163217,Benefit-Risk Assessment of Rivaroxaban in Older Patients With Nonvalvular Atrial Fibrillation or Venous Thromboembolism.,Drugs & aging,2025,Aspirin,Atrial Fibrillation
40134583,Effect of periprocedural anticoagulation on patient outcomes after transcatheter edge to edge repair of mitral valve with MitraClip(TM); an insight from nationwide dataset.,International journal of cardiology. Heart & vasculature,2025,Aspirin,Atrial Fibrillation
40117694,Apixaban Dose in Patients With Atrial Fibrillation and Acute Coronary Syndrome and/or Undergoing Percutaneous Coronary Intervention: Insights From AUGUSTUS.,JACC. Advances,2025,Aspirin,Atrial Fibrillation
40107681,Different antithrombotic strategies after left atrial appendage closure with the LACbes occluder: protocol of the DAAL trial.,BMJ open,2025,Aspirin,Atrial Fibrillation
40040740,The role of triple antithrombotic therapy in patients with atrial fibrillation and coronary stent insertion.,Australian prescriber,2025,Aspirin,Atrial Fibrillation
40035552,Comparative Analysis of the Efficacy of Esomeprazole and Ilaprazole in Patients With Neurological Disorders Using the Gastroesophageal Reflux Disease Questionnaire.,Clinical neuropharmacology,2025,Aspirin,Atrial Fibrillation
40014670,2025 ACC/AHA/ACEP/NAEMSP/SCAI Guideline for the Management of Patients With Acute Coronary Syndromes: A Report of the American College of Cardiology/American Heart Association Joint Committee on Clinical Practice Guidelines.,Circulation,2025,Aspirin,Atrial Fibrillation
40013746,2025 ACC/AHA/ACEP/NAEMSP/SCAI Guideline for the Management of Patients With Acute Coronary Syndromes: A Report of the American College of Cardiology/American Heart Association Joint Committee on Clinical Practice Guidelines.,Journal of the American College of Cardiology,2025,Aspirin,Atrial Fibrillation
40007971,Antithrombotic Therapy in Carotid Artery and Intracranial Artery Stent.,Journal of neuroendovascular therapy,2025,Aspirin,Atrial Fibrillation
39996141,Safety and efficacy of edoxaban monotherapy after bioabsorbable polymer everolimus-eluting stent implantation in a human-like coronary atherosclerotic porcine model.,Atherosclerosis plus,2025,Aspirin,Atrial Fibrillation
39973422,Prevalence of bleeding in patients on single or dual antiplatelet therapy combined with vitamin K antagonists or direct oral anticoagulants.,The International journal of risk & safety in medicine,2025,Aspirin,Atrial Fibrillation
39958461,Early Antithrombotic Therapy in Acute Ischemic Stroke.,Journal of neuroendovascular therapy,2025,Aspirin,Atrial Fibrillation
39957894,A Case of Extended Duration Triple Antithrombotic Therapy in a Patient With an Intracranial Stent and Atrial Fibrillation.,The Neurohospitalist,2025,Aspirin,Atrial Fibrillation
39919210,Rivaroxaban to reduce the risk of major cardiovascular events in patients with chronic coronary artery disease or peripheral artery disease: a narrative review.,Expert opinion on drug safety,2025,Aspirin,Atrial Fibrillation
39918467,Antithrombotic Therapy to Minimize Total Events After ACS or PCI in Atrial Fibrillation: Insights From AUGUSTUS.,Journal of the American College of Cardiology,2025,Aspirin,Atrial Fibrillation
39877795,"""Breaking the Bleed"" Spontaneous Hemorrhage in an Emphysematous Bulla Complicated by Anticoagulation: A Case Report.",Cureus,2024,Aspirin,Atrial Fibrillation
