PMID,Title,Journal,Year
34317664,Eosinophilic Myocarditis in a Patient With Strongyloides stercoralis Infection.,JACC. Case reports,2021
33452066,Deep vein thrombosis with pulmonary thromboembolism in a case of severe COVID-19 pneumonia.,BMJ case reports,2021
23384581,Variation of D-dimer values as assessment of pulmonary thromboembolism during adulticide treatment of heartworm disease in dogs.,Veterinary parasitology,2013
18602759,Computed tomography (CT) observation of pulmonary emboli caused by long-term administration of ivermectin in dogs experimentally infected with heartworms.,Veterinary parasitology,2008
3754294,"Verminous vasculitis, pneumonia and pulmonary infarction in a cynomolgus monkey after treatment with ivermectin.",Laboratory animal science,1986
