PMID,Title,Journal,Year
40842772,Suspected Drug-Induced Liver Injury Associated With Ceftriaxone: A Case Report.,Cureus,2025
40736492,Top 20 Research Studies of 2024 for Primary Care Physicians.,American family physician,2025
31080743,Role of nanostructures in improvising oral medicine.,Toxicology reports,2019
29248451,Features and outcomes of drugs for combination therapy as multi-targets strategy to combat Alzheimer's disease.,Journal of ethnopharmacology,2018
16842099,"RNA therapeutics directed to the non coding regions of APP mRNA, in vivo anti-amyloid efficacy of paroxetine, erythromycin, and N-acetyl cysteine.",Current Alzheimer research,2006
15314261,FDA-preapproved drugs targeted to the translational regulation and processing of the amyloid precursor protein.,Journal of molecular neuroscience : MN,2004
14501007,Drug discovery targeted to the Alzheimer's APP mRNA 5'-untranslated region: the action of paroxetine and dimercaptopropanol.,Journal of molecular neuroscience : MN,2003
