PMID,Title,Journal,Year
40575645,COVID-19 management in patients with comorbid conditions.,World journal of virology,2025
36500388,Local Delivery of Azithromycin Nanoformulation Attenuated Acute Lung Injury in Mice.,"Molecules (Basel, Switzerland)",2022
35131658,Antiviral effects of azithromycin: A narrative review.,Biomedicine & pharmacotherapy = Biomedecine & pharmacotherapie,2022
32972196,Clinical evidences on the antiviral properties of macrolide antibiotics in the COVID-19 era and beyond.,Antiviral chemistry & chemotherapy,2020
32969125,Azithromycin in viral infections.,Reviews in medical virology,2021
32744592,"Searching for COVID-19 treatments: First, do no harm.",American journal of health-system pharmacy : AJHP : official journal of the American Society of Health-System Pharmacists,2020
32323646,Chloroquine and Hydroxychloroquine for the Prevention or Treatment of COVID-19 in Africa: Caution for Inappropriate Off-label Use in Healthcare Settings.,The American journal of tropical medicine and hygiene,2020
31806372,Combinatorial screening of a panel of FDA-approved drugs identifies several candidates with anti-Ebola activities.,Biochemical and biophysical research communications,2020
27622822,Evaluation of Ebola Virus Inhibitors for Drug Repurposing.,ACS infectious diseases,2015
