pmid,title,journal,year,drug,disease
33457061,"Therapy Management Using Modified 2-Weeks-On/1-Week-Off Dosing Schedule in Patients With Metastatic Renal Cell Carcinoma Receiving Sunitinib: A Hypothetical, Illustrative Case Scenario.",Journal of the advanced practitioner in oncology,2019,Lisinopril,Prostate Cancer
30564469,"Management of Older Patients With Metastatic Renal Cell Carcinoma Receiving Sunitinib: A Hypothetical, Illustrative Case Scenario.",Journal of the advanced practitioner in oncology,2018,Lisinopril,Prostate Cancer
23076627,A surprising cause of masses in the chest.,American journal of hematology,2013,Lisinopril,Prostate Cancer
20804693,[A new case of nevus oligemicus].,Dermatology online journal,2010,Lisinopril,Prostate Cancer
12497091,Interpretation of the ALLHAT interim analysis and implications for the treatment of patients with BPH.,Prostate cancer and prostatic diseases,2000,Lisinopril,Prostate Cancer
