pmid,title,journal,year,drug,disease
38923498,Beta-blockers for the treatment of infantile haemangiomas in premature infants.,The Australasian journal of dermatology,2024,Timolol,Lung Cancer
36112905,Combination of available topical beta-blockers and antibiotic ointment for epidermal growth factor receptor tyrosine kinase inhibitor-induced paronychia and pseudopyogenic granulomas in Taiwan.,Journal of oncology pharmacy practice : official publication of the International Society of Oncology Pharmacy Practitioners,2023,Timolol,Lung Cancer
35335303,The Effect of Beta Adrenoreceptor Blockers on Viability and Cell Colony Formation of Non-Small Cell Lung Cancer Cell Lines A549 and H1299.,"Molecules (Basel, Switzerland)",2022,Timolol,Lung Cancer
32526318,Management of paronychia with pseudopyogenic granulomas secondary to epidermal growth factor receptor inhibitors: An assessment of topical timolol and the need for multiple medical and procedural therapies.,Journal of the American Academy of Dermatology,2021,Timolol,Lung Cancer
16845450,Gateways to clinical trials.,Methods and findings in experimental and clinical pharmacology,2006,Timolol,Lung Cancer
