PMID,Title,Journal,Year
34491768,Hybrid Cyclic-Linear Cell-Penetrating Peptides Containing Alternative Positively Charged and Hydrophobic Residues as Molecular Transporters.,Molecular pharmaceutics,2021
31361841,Delayed-onset effect of clofarabine in the treatment of an adult patient with acute myeloid leukemia.,American journal of health-system pharmacy : AJHP : official journal of the American Society of Health-System Pharmacists,2019
29949881,Efficient Intracellular Delivery of Cell-Impermeable Cargo Molecules by Peptides Containing Tryptophan and Histidine.,"Molecules (Basel, Switzerland)",2018
25394095,"Efficacy, safety, and lack of interactions with the use of raltegravir in HIV-infected patients undergoing antineoplastic chemotherapy.",Journal of the International AIDS Society,2014
23834324,Surface decorated gold nanoparticles by linear and cyclic peptides as molecular transporters.,Molecular pharmaceutics,2013
21856551,Acute promyelocytic leukemia in HIV-infected adults: a case report and review of therapeutic considerations.,"Clinical lymphoma, myeloma & leukemia",2010
7684216,Characterization of human immunodeficiency viruses resistant to oxathiolane-cytosine nucleosides.,Antimicrobial agents and chemotherapy,1993
