PMID,Title,Journal,Year
40100484,Drug repositioning as a promising approach for the eradication of emerging and re-emerging viral agents.,Molecular diversity,2025
35405102,Community-based trial assessing the impact of annual versus semiannual mass drug administration with ivermectin plus albendazole and praziquantel on helminth infections in northwestern Liberia.,Acta tropica,2022
33661903,"Community-directed distributors-The ""foot soldiers"" in the fight to control and eliminate neglected tropical diseases.",PLoS neglected tropical diseases,2021
33370270,Achievements and challenges of lymphatic filariasis elimination in Sierra Leone.,PLoS neglected tropical diseases,2020
31262367,Soil-transmitted helminth infection in school age children in Sierra Leone after a decade of preventive chemotherapy interventions.,Infectious diseases of poverty,2019
29409509,"""Cross-border collaboration in onchocerciasis elimination in Uganda: progress, challenges and opportunities from 2008 to 2013"".",Globalization and health,2018
26666700,"Community Attitudes Toward Mass Drug Administration for Control and Elimination of Neglected Tropical Diseases After the 2014 Outbreak of Ebola Virus Disease in Lofa County, Liberia.",The American journal of tropical medicine and hygiene,2016
16406332,New medicines from nature's armamentarium.,Trends in parasitology,2006
