pmid,title,journal,year,drug,disease
40546884,"The concentration of tuberculosis within Paraguay's Indigenous population, 2018-2022: a retrospective population-based study.",Lancet regional health. Americas,2025,Paxlovid,Tuberculosis
39615498,Signatures of transmission in within-host Mycobacterium tuberculosis complex variation: a retrospective genomic epidemiology study.,The Lancet. Microbe,2025,Paxlovid,Tuberculosis
39419058,Mass incarceration as a driver of the tuberculosis epidemic in Latin America and projected effects of policy alternatives: a mathematical modelling study.,The Lancet. Public health,2024,Paxlovid,Tuberculosis
38967233,Fixing the Achilles Heel of Pfizer's Paxlovid for COVID-19 Treatment.,Journal of medicinal chemistry,2024,Paxlovid,Tuberculosis
37719651,Efficacy of Nirmatrelvir-Ritonavir versus Azvudine for COVID-19 Treatment in Tibet: A Retrospective Study.,Infection and drug resistance,2023,Paxlovid,Tuberculosis
37018987,Paxlovid (Nirmatrelvir/Ritonavir): A new approach to Covid-19 therapy?,Biomedicine & pharmacotherapy = Biomedecine & pharmacotherapie,2023,Paxlovid,Tuberculosis
