pmid,title,journal,year,drug,disease
40399888,"Emerging risks of lipid-lowering therapy and low LDL levels: implications for eye, brain, and new-onset diabetes.",Lipids in health and disease,2025,Statins,Glaucoma
40204116,Racial and Ethnic Differences in the Association Between Statin Use and the Risk of Ocular Hypertension and Open-Angle Glaucoma.,American journal of ophthalmology,2025,Statins,Glaucoma
40057902,Re: Lee et al.: Associations between statin use and glaucoma in the All of Us Research Program (Ophthalmol Glaucoma. 2024;7:563-571).,Ophthalmology. Glaucoma,2025,Statins,Glaucoma
40057900,Re: Lee et al.: Associations between statin use and glaucoma in the All of Us Research Program (Ophthalmol Glaucoma. 2024;7:563-571).,Ophthalmology. Glaucoma,2025,Statins,Glaucoma
39863057,Glucagon-like Peptide-1 Receptor Agonist Impact on Chronic Ocular Disease Including Age-Related Macular Degeneration.,Ophthalmology,2025,Statins,Glaucoma
39658273,Preoperative interatrial block is associated with postoperative atrial fibrillation after cardiac surgery.,Interdisciplinary cardiovascular and thoracic surgery,2025,Statins,Glaucoma
39212799,Associations of different types of statins with the risk of open-angle glaucoma: a systematic review and network meta-analysis.,Graefe's archive for clinical and experimental ophthalmology = Albrecht von Graefes Archiv fur klinische und experimentelle Ophthalmologie,2025,Statins,Glaucoma
39094953,Associations between Statin Use and Glaucoma in the All of Us Research Program.,Ophthalmology. Glaucoma,2024,Statins,Glaucoma
39044766,Is a Carotid Doppler Scan Useful for Managing Patients with Suspected Ocular Ischemic Syndrome?,"Clinical ophthalmology (Auckland, N.Z.)",2024,Statins,Glaucoma
38184223,Modulation of TRPV4-mediated TNF-alpha expression in Muller glia and subsequent RGC apoptosis by statins.,Experimental eye research,2024,Statins,Glaucoma
38000334,Novel frontiers in neuroprotective therapies in glaucoma: Molecular and clinical aspects.,Molecular aspects of medicine,2023,Statins,Glaucoma
37956319,Impact of Dyslipidemia Medications on the Prevalence of Diabetic Retinopathy Among a Large US Cohort.,"Ophthalmic surgery, lasers & imaging retina",2023,Statins,Glaucoma
37888091,Relationship of Medication Intake and Systemic Conditions with Periodontitis: A Retrospective Study.,Journal of personalized medicine,2023,Statins,Glaucoma
37468563,Association between statin use and open-angle glaucoma: a nested case-control study using the Japanese claims database.,Scientific reports,2023,Statins,Glaucoma
37422546,Effects of atorvastatin on the function of Tenon's capsule fibroblasts in human eyes.,International ophthalmology,2023,Statins,Glaucoma
37242493,The Effect of Statins on Ocular Disorders: A Systematic Review of Randomized Controlled Trials.,"Pharmaceuticals (Basel, Switzerland)",2023,Statins,Glaucoma
37203063,Study of the relationship between serum lipid levels and primary open-angle glaucoma.,Indian journal of ophthalmology,2023,Statins,Glaucoma
37083467,Simvastatin Attenuates Glucocorticoid-Induced Human Trabecular Meshwork Cell Dysfunction via YAP/TAZ Inactivation.,Current eye research,2023,Statins,Glaucoma
36464210,The role of statins in diabetic retinopathy.,Trends in cardiovascular medicine,2024,Statins,Glaucoma
36117363,Lipid metabolism and retinal diseases.,Acta ophthalmologica,2022,Statins,Glaucoma
35848984,Effectiveness of Topical rho-Kinase Inhibitors in Veterans with Severe Glaucoma on Maximally Tolerated Medical Therapy.,Optometry and vision science : official publication of the American Academy of Optometry,2022,Statins,Glaucoma
35829808,Cholesterol homeostasis regulated by ABCA1 is critical for retinal ganglion cell survival.,Science China. Life sciences,2023,Statins,Glaucoma
35612836,"Statin Use in Relation to Intraocular Pressure, Glaucoma, and Ocular Coherence Tomography Parameters in the UK Biobank.",Investigative ophthalmology & visual science,2022,Statins,Glaucoma
35563594,"Statins Inhibit the Gliosis of MIO-M1, a Muller Glial Cell Line Induced by TRPV4 Activation.",International journal of molecular sciences,2022,Statins,Glaucoma
35537803,Association between statin use and rates of structural and functional loss in glaucoma.,The British journal of ophthalmology,2023,Statins,Glaucoma
35470970,Risk of glaucoma after vitreoretinal surgery - Findings from a population-based cohort study.,Acta ophthalmologica,2022,Statins,Glaucoma
35417030,Atorvastatin reduces IOP in ocular hypertension in vivo and suppresses ECM in trabecular meshwork perhaps via FGD4.,International journal of molecular medicine,2022,Statins,Glaucoma
35399812,Associations of statin use with the onset and progression of open-angle glaucoma: A systematic review and meta-analysis.,EClinicalMedicine,2022,Statins,Glaucoma
34830387,Neuroprotective Effect of Statins in a Rat Model of Chronic Ocular Hypertension.,International journal of molecular sciences,2021,Statins,Glaucoma
34731871,Multiple Systemic Vascular Risk Factors Are Associated With Low-Tension Glaucoma.,Journal of glaucoma,2022,Statins,Glaucoma
34592243,High-Density Lipoprotein 3 Cholesterol and Primary Open-Angle Glaucoma: Metabolomics and Mendelian Randomization Analyses.,Ophthalmology,2022,Statins,Glaucoma
34517373,Nonocular Influencing Factors for Primary Glaucoma: An Umbrella Review of Meta-Analysis.,Ophthalmic research,2021,Statins,Glaucoma
34348924,Association between statin use and the risks of glaucoma in Australia: a 10-year cohort study.,The British journal of ophthalmology,2023,Statins,Glaucoma
34208432,Erlanger Glaucoma Registry: Effect of a Long-Term Therapy with Statins and Acetyl Salicylic Acid on Glaucoma Conversion and Progression.,Biology,2021,Statins,Glaucoma
33755323,Statin use and the reoperation rates in glaucoma filtration surgery - population-based cohort study.,Acta ophthalmologica,2022,Statins,Glaucoma
33506616,Cholesterol and glaucoma: a systematic review and meta-analysis.,Acta ophthalmologica,2022,Statins,Glaucoma
33449961,Effect of oral statin use on mitomycin-C augmented trabeculectomy outcomes.,PloS one,2021,Statins,Glaucoma
33403458,[Rho kinase inhibitors as new local therapy option in primary open angle glaucoma].,Der Ophthalmologe : Zeitschrift der Deutschen Ophthalmologischen Gesellschaft,2021,Statins,Glaucoma
33026527,[Vasculat treatment concepts in glaucoma patients].,Der Ophthalmologe : Zeitschrift der Deutschen Ophthalmologischen Gesellschaft,2021,Statins,Glaucoma
32804969,Comparison between high and low potency statins in the incidence of open-angle glaucoma: A retrospective cohort study in Japanese working-age population.,PloS one,2020,Statins,Glaucoma
32730956,Cardiovascular Disease Predicts Structural and Functional Progression in Early Glaucoma.,Ophthalmology,2021,Statins,Glaucoma
32163112,Notice of Retraction and Replacement. Kang et al. Association of statin use and high serum cholesterol levels with risk of primary open-angle glaucoma. JAMA Ophthalmol. 2019;137(7):756-765.,JAMA ophthalmology,2020,Statins,Glaucoma
32040978,[Secondary Neuroprotection in Glaucoma Through the Concepts of Complementary Drug Therapy].,Klinische Monatsblatter fur Augenheilkunde,2020,Statins,Glaucoma
31982202,Rho-kinase ROCK inhibitors reduce oligomeric tau protein.,Neurobiology of aging,2020,Statins,Glaucoma
31675072,Association of Systemic Medication Exposure With Glaucoma Progression and Glaucoma Suspect Conversion in the Groningen Longitudinal Glaucoma Study.,Investigative ophthalmology & visual science,2019,Statins,Glaucoma
31595027,A review of systemic medications that may modulate the risk of glaucoma.,"Eye (London, England)",2020,Statins,Glaucoma
31046110,The Role of Statins and Cholesterol in the Primary Prevention of Primary Open-Angle Glaucoma.,JAMA ophthalmology,2019,Statins,Glaucoma
31046067,Association of Statin Use and High Serum Cholesterol Levels With Risk of Primary Open-Angle Glaucoma.,JAMA ophthalmology,2019,Statins,Glaucoma
30927359,Restriction of Pharmacoepidemiologic Cohorts to Initiators of Medications in Unrelated Preventive Drug Classes to Reduce Confounding by Frailty in Older Adults.,American journal of epidemiology,2019,Statins,Glaucoma
30889059,"Dyslipidemia, Dyslipidemia Treatment, and Open-angle Glaucoma in the Korean National Health and Nutrition Examination Survey.",Journal of glaucoma,2019,Statins,Glaucoma
