pmid,title,journal,year,drug,disease
40100484,Drug repositioning as a promising approach for the eradication of emerging and re-emerging viral agents.,Molecular diversity,2025,Ruxolitinib,Zika Virus
37766278,"Broad-Spectrum Antiviral Activity of Influenza A Defective Interfering Particles against Respiratory Syncytial, Yellow Fever, and Zika Virus Replication In Vitro.",Viruses,2023,Ruxolitinib,Zika Virus
35126336,HSV-2 Infection Enhances Zika Virus Infection of Primary Genital Epithelial Cells Independently of the Known Zika Virus Receptor AXL.,Frontiers in microbiology,2021,Ruxolitinib,Zika Virus
28784796,Organotypic models of type III interferon-mediated protection from Zika virus infections at the maternal-fetal interface.,Proceedings of the National Academy of Sciences of the United States of America,2017,Ruxolitinib,Zika Virus
28776046,"Jak Inhibitors Modulate Production of Replication-Competent Zika Virus in Human Hofbauer, Trophoblasts, and Neuroblastoma cells.",Pathogens & immunity,2017,Ruxolitinib,Zika Virus
