PMID,Title,Journal,Year
40455688,Cancer incidence in patients with ulcerative colitis naive to or treated with thiopurine and targeted therapies-a cohort study 2007 to 2022 with comparison to the general population.,Journal of Crohn's & colitis,2025
40310056,Intensified Upadacitinib Dosing for Adolescent Patients with Acute Severe Ulcerative Colitis.,"Children (Basel, Switzerland)",2025
40281872,New Therapeutic Challenges in Pediatric Gastroenterology: A Narrative Review.,"Healthcare (Basel, Switzerland)",2025
34002219,Patients With Inflammatory Bowel Disease on Treatment Have Lower Rates of Celiac Disease.,Inflammatory bowel diseases,2022
29072309,HLA-Cw6 and psoriasis.,The British journal of dermatology,2018
