pmid,title,journal,year,drug,disease
39050334,A Rare Cause of Pancytopenia in Systemic Lupus Erythematosus (SLE) in a Young Patient.,Cureus,2024,Lisinopril,Systemic Lupus Erythematosus
32793221,Targeting the Protective Arm of the Renin-Angiotensin System to Reduce Systemic Lupus Erythematosus Related Pathologies in MRL-lpr Mice.,Frontiers in immunology,2020,Lisinopril,Systemic Lupus Erythematosus
24369514,Diffuse leukoencephalopathy and subacute parkinsonism as an early manifestation of systemic lupus erythematosus.,Case reports in neurological medicine,2013,Lisinopril,Systemic Lupus Erythematosus
16871238,Hematuria in a patient with class IV lupus nephritis.,Kidney international,2006,Lisinopril,Systemic Lupus Erythematosus
11780682,"Antinuclear antibody-negative, drug-induced lupus caused by lisinopril.",Southern medical journal,2001,Lisinopril,Systemic Lupus Erythematosus
9391702,Absence of cross-reaction between lisinopril and enalapril in drug-induced lupus.,The Annals of pharmacotherapy,1997,Lisinopril,Systemic Lupus Erythematosus
