pmid,title,journal,year,drug,disease
38991533,Public Health Surveillance in Electronic Health Records: Lessons From PCORnet.,Preventing chronic disease,2024,Warfarin,Hepatitis C
38361436,Protein kinase C delta enhances the diagnostic performance of hepatocellular carcinoma.,"Biomarkers : biochemical indicators of exposure, response, and susceptibility to chemicals",2024,Warfarin,Hepatitis C
37779775,Cutaneous Leukocytoclastic Vasculitis Induced by Apixaban and/or Rivaroxaban With Seronegative Anti-Neutrophil Cytoplasmic Antibody (ANCA) Titers: A Case Report and Literature Review.,Cureus,2023,Warfarin,Hepatitis C
36103593,Safe co-administration of direct-acting antivirals and direct oral anticoagulants among patients with hepatitis C virus infection: An international multicenter retrospective cohort study.,Journal of viral hepatitis,2022,Warfarin,Hepatitis C
34641870,An informatics consult approach for generating clinical evidence for treatment decisions.,BMC medical informatics and decision making,2021,Warfarin,Hepatitis C
33393016,Effect of Hepatitis C Drugs on Blood Coagulability in Patients on Warfarin Using the Medical Information Database Network (MID-NET((R))) in Japan.,Therapeutic innovation & regulatory science,2021,Warfarin,Hepatitis C
31418789,Decreased warfarin sensitivity among patients treated with elbasvir and grazoprevir for hepatitis C infection.,American journal of health-system pharmacy : AJHP : official journal of the American Society of Health-System Pharmacists,2019,Warfarin,Hepatitis C
30978730,Direct-Acting Oral Anticoagulants (DOACs) in Cirrhosis and Cirrhosis-Associated Portal Vein Thrombosis.,Seminars in liver disease,2019,Warfarin,Hepatitis C
30784359,Dynamics and management of oral anticoagulant treatment in chronic hepatitis C patients undergoing therapy with direct antiviral agents.,"Journal of chemotherapy (Florence, Italy)",2019,Warfarin,Hepatitis C
29886103,Randomized controlled trial of rivaroxaban versus warfarin in the management of acute non-neoplastic portal vein thrombosis.,Vascular pharmacology,2019,Warfarin,Hepatitis C
29458277,Inductive Effect of a Ritonavir-Containing Hepatitis C Treatment Regimen on Warfarin in a Patient-A Case Report.,Journal of pharmacy practice,2019,Warfarin,Hepatitis C
29349091,Coexistent Ipsilateral Internal Carotid Artery Occlusion and Cerebral Venous Thrombosis in Hepatitis C.,Journal of investigative medicine high impact case reports,2018,Warfarin,Hepatitis C
28842460,Reduction in warfarin effect associated with sofosbuvir-velpatasvir.,American journal of health-system pharmacy : AJHP : official journal of the American Society of Health-System Pharmacists,2017,Warfarin,Hepatitis C
28596225,Increased warfarin requirements in a patient with chronic hepatitis C infection receiving sofosbuvir and ribavirin.,American journal of health-system pharmacy : AJHP : official journal of the American Society of Health-System Pharmacists,2017,Warfarin,Hepatitis C
28100063,Evaluation of a Potential Interaction Between New Regimens to Treat Hepatitis C and Warfarin: Twelve-Week Post-treatment Follow-up.,The Annals of pharmacotherapy,2017,Warfarin,Hepatitis C
27813106,Paritaprevir/ritonavir/ombitasvir+dasabuvir plus ribavirin therapy and inhibition of the anticoagulant effect of warfarin: a case report.,Journal of clinical pharmacy and therapeutics,2017,Warfarin,Hepatitis C
27716978,Influence of Successful Chronic Hepatitis C Virus Treatment with Ledipasvir/Sofosbuvir on Warfarin Dosing Requirements in Four Veterans.,Pharmacotherapy,2016,Warfarin,Hepatitis C
27465881,Evaluation of a Potential Interaction Between New Regimens to Treat Hepatitis C and Warfarin.,The Annals of pharmacotherapy,2016,Warfarin,Hepatitis C
26459906,Drug Interactions with the Direct-Acting Antiviral Combination of Ombitasvir and Paritaprevir-Ritonavir.,Antimicrobial agents and chemotherapy,2016,Warfarin,Hepatitis C
25646891,"Drug-drug interaction profile of the all-oral anti-hepatitis C virus regimen of paritaprevir/ritonavir, ombitasvir, and dasabuvir.",Journal of hepatology,2015,Warfarin,Hepatitis C
25515435,Warfarin and boceprevir interaction causing subtherapeutic international normalized ratio: a case report.,Journal of medical case reports,2014,Warfarin,Hepatitis C
25449227,Interactions of the hepatitis C virus protease inhibitor faldaprevir with cytochrome P450 enzymes: in vitro and in vivo correlation.,Journal of clinical pharmacology,2015,Warfarin,Hepatitis C
24548174,Methods and software tools for design evaluation in population pharmacokinetics-pharmacodynamics studies.,British journal of clinical pharmacology,2015,Warfarin,Hepatitis C
24034307,Value-based assessment of pharmacodiagnostic testing from early stage development to real-world use.,Value in health : the journal of the International Society for Pharmacoeconomics and Outcomes Research,2013,Warfarin,Hepatitis C
23995112,Portal vein thrombosis during eltrombopag treatment for immune thrombocytopenic purpura in a patient with liver cirrhosis due to hepatitis C viral infection.,Journal of clinical and experimental hematopathology : JCEH,2013,Warfarin,Hepatitis C
23879227,Potential P-glycoprotein pharmacokinetic interaction of telaprevir with morphine or methadone.,Journal of pain & palliative care pharmacotherapy,2013,Warfarin,Hepatitis C
23872824,A randomised study of the effect of danoprevir/ritonavir or ritonavir on substrates of cytochrome P450 (CYP) 3A and 2C9 in chronic hepatitis C patients using a drug cocktail.,European journal of clinical pharmacology,2013,Warfarin,Hepatitis C
23742625,Bleeding risk in patients with esophageal varices undergoing transesophageal echocardiography.,"Echocardiography (Mount Kisco, N.Y.)",2013,Warfarin,Hepatitis C
23314858,Portal vein thrombosis in patients with end stage liver disease awaiting liver transplantation: outcome of anticoagulation.,Digestive diseases and sciences,2013,Warfarin,Hepatitis C
23172264,Apparent interaction between telaprevir and warfarin in a patient with chronic hepatitis C viral infection.,American journal of health-system pharmacy : AJHP : official journal of the American Society of Health-System Pharmacists,2012,Warfarin,Hepatitis C
22863964,[Successful use of danaparoid in the treatment of portal vein thrombosis that developed in a warfarin-administered hepatitis C virus-related cirrhosis patient].,Nihon Shokakibyo Gakkai zasshi = The Japanese journal of gastro-enterology,2012,Warfarin,Hepatitis C
21996974,[Gastrointestinal hemorrhage associated with concurrent use of sorafenib and warfarin for hepatocellular carcinoma].,Gan to kagaku ryoho. Cancer & chemotherapy,2011,Warfarin,Hepatitis C
19923313,Elevated International Normalized Ratio associated with concurrent use of sorafenib and warfarin.,American journal of health-system pharmacy : AJHP : official journal of the American Society of Health-System Pharmacists,2009,Warfarin,Hepatitis C
19815307,Personalized medicine: factors influencing reimbursement.,"Health policy (Amsterdam, Netherlands)",2010,Warfarin,Hepatitis C
19809309,Anticoagulation after liver transplantation: a retrospective audit and case-control study.,Blood coagulation & fibrinolysis : an international journal in haemostasis and thrombosis,2009,Warfarin,Hepatitis C
20428402,Interferon-alpha is a predisposing risk factor for carbamazepine-induced hyponatremia: A case of syndrome of inappropriate antidiuresis caused by interferon-alpha therapy.,International journal of general medicine,2008,Warfarin,Hepatitis C
18438797,Hepatitis C-associated leukocytoclastic vasculitis with anticardiolipin antibodies causing penile necrosis and deep venous thrombosis in the absence of cryoglobulinemia.,Journal of hospital medicine,2008,Warfarin,Hepatitis C
17287904,A case of deep venous thrombosis associated with pegylated interferon alpha2b plus ribavirin treatment of chronic hepatitis C.,Journal of gastroenterology,2006,Warfarin,Hepatitis C
17229075,Ten-year experience in porto-caval hemitransposition for liver transplantation in the presence of portal vein thrombosis.,American journal of transplantation : official journal of the American Society of Transplantation and the American Society of Transplant Surgeons,2007,Warfarin,Hepatitis C
16523924,"[Membranoproliferative glomerulonephritis: Pathogenesis, pathophysiology and therapy].",Nihon rinsho. Japanese journal of clinical medicine,2006,Warfarin,Hepatitis C
16253716,Sudden late onset of gross hematuria in a previous renal transplant recipient 3 months after transplant nephrectomy.,American journal of kidney diseases : the official journal of the National Kidney Foundation,2005,Warfarin,Hepatitis C
16163209,Subcutaneous lepirudin for heparin-induced thrombocytopenia and when other anticoagulants fail: illustrative cases.,Clinical advances in hematology & oncology : H&O,2004,Warfarin,Hepatitis C
15365265,Klinefelter's syndrome presenting with leg ulcers.,Skinmed,2004,Warfarin,Hepatitis C
12740679,Mitral valve vegetation and cerebral emboli in a primary antiphospholipid syndrome patient who had hepatitis C virus infection: report of a case and review of the literature.,Clinical rheumatology,2003,Warfarin,Hepatitis C
12400845,Measurement of des-gamma-carboxy prothrombin levels in hemodialysis patients positive for anti-hepatitis virus C antibody.,Clinical nephrology,2002,Warfarin,Hepatitis C
11816263,Inhibition of warfarin activity by ribavirin.,The Annals of pharmacotherapy,2002,Warfarin,Hepatitis C
11741245,Assessing the cost-effectiveness of pharmacogenomics.,AAPS pharmSci,2000,Warfarin,Hepatitis C
11224691,Antiphospholipid antibody syndrome and renal disease.,Current opinion in nephrology and hypertension,2001,Warfarin,Hepatitis C
10964121,High prevalence of iliofemoral venous thrombosis with severe groin infection among injecting drug users in North East Scotland: successful use of low molecular weight heparin with antibiotics.,Postgraduate medical journal,2000,Warfarin,Hepatitis C
10781193,Cardiac surgery and catheterization in patients with haemophilia.,Haemophilia : the official journal of the World Federation of Hemophilia,2000,Warfarin,Hepatitis C
