PMID,Title,Journal,Year
40100484,Drug repositioning as a promising approach for the eradication of emerging and re-emerging viral agents.,Molecular diversity,2025
40018116,Addressing challenges in vector control: a review of current strategies and the imperative for novel tools in India's combat against vector-borne diseases.,BMJ public health,2024
39226139,"Donor-derived infections-Insights from Singapore, Japan, and Thailand.",Transplant infectious disease : an official journal of the Transplantation Society,2024
38004467,"Synergistic In Vitro Antiviral Effect of Combinations of Ivermectin, Essential Oils, and 18-(Phthalimid-2-yl)ferruginol against Arboviruses and Herpesvirus.","Pharmaceuticals (Basel, Switzerland)",2023
33439253,Antivirals that target the host IMPalpha/beta1-virus interface.,Biochemical Society transactions,2021
33341233,The broad spectrum host-directed agent ivermectin as an antiviral for SARS-CoV-2 ?,Biochemical and biophysical research communications,2021
32942671,Ivermectin as a Broad-Spectrum Host-Directed Antiviral: The Real Deal?,Cells,2020
32533071,Ivermectin: a systematic review from antiviral effects to COVID-19 complementary regimen.,The Journal of antibiotics,2020
26752081,"Discovery of berberine, abamectin and ivermectin as antivirals against chikungunya and other alphaviruses.",Antiviral research,2016
