pmid,title,journal,year,drug,disease
21909991,Simvastatin attenuates intestinal fibrosis independent of the anti-inflammatory effect by promoting fibroblast/myofibroblast apoptosis in the regeneration/healing process from TNBS-induced colitis.,Digestive diseases and sciences,2012,Simvastatin,Crohn's Disease
18840670,Statins alter neutrophil migration by modulating cellular Rho activity--a potential mechanism for statins-mediated pleotropic effects?,Journal of leukocyte biology,2009,Simvastatin,Crohn's Disease
18635600,Role of MutS homolog 2 (MSH2) in intestinal myofibroblast proliferation during Crohn's disease stricture formation.,American journal of physiology. Gastrointestinal and liver physiology,2008,Simvastatin,Crohn's Disease
18285654,"Basic and clinical aspects of non-neuronal acetylcholine: expression of an independent, non-neuronal cholinergic system in lymphocytes and its clinical significance in immunotherapy.",Journal of pharmacological sciences,2008,Simvastatin,Crohn's Disease
18049901,"Simvastatin attenuates trinitrobenzene sulfonic acid-induced colitis, but not oxazalone-induced colitis.",Digestive diseases and sciences,2008,Simvastatin,Crohn's Disease
15178225,Large-artery stroke in a young patient with Crohn's disease. Role of vitamin B6 deficiency-induced hyperhomocysteinemia.,Journal of the neurological sciences,2004,Simvastatin,Crohn's Disease
10323894,Mesalazine (5-aminosalicylic acid) induced chronic hepatitis.,Gut,1999,Simvastatin,Crohn's Disease
